id,title,venue,authors,year,abstract,citations,influential_citations,clean_text,CPS,Blockchain,IoT,Fault Tolerance,Distributed Systems,sim_max,S_Quali,C_Norm,V_Norm,S_Quant,Score_Global
https://openalex.org/W4283015175,YOU SHALL NOT COMPUTE on my Data: Access Policies for Privacy-Preserving Data Marketplaces and an Implementation for a Distributed Market using MPC,ARES (Validação DBLP),"Stefan More, Lukas Alber",2022,"Personal data is an attractive source of insights for a diverse field of research and business. While our data is highly valuable, it is often privacy-sensitive. Thus, regulations like the GDPR restrict what data can be legally published, and what a buyer may do with this sensitive data. While personal data must be protected, we can still sell some insights gathered from our data that do not hurt our privacy. A data marketplace is a platform that helps users to sell their data while assisting buyers in discovering relevant datasets. The major challenge such a marketplace faces is balancing between offering valuable insights into data while preserving privacy requirements. Private data marketplaces try to solve this challenge by offering privacy-preserving computations on personal data. Such computations allow for calculating statistics or training machine learning models on personal data without accessing the data in plain. However, the user selling the data cannot restrict who can buy or what type of computation the data is allowed.",7,7,"YOU SHALL NOT COMPUTE on my Data: Access Policies for Privacy-Preserving Data Marketplaces and an Implementation for a Distributed Market using MPC Personal data is an attractive source of insights for a diverse field of research and business. While our data is highly valuable, it is often privacy-sensitive. Thus, regulations like the GDPR restrict what data can be legally published, and what a buyer may do with this sensitive data. While personal data must be protected, we can still sell some insights gathered from our data that do not hurt our privacy. A data marketplace is a platform that helps users to sell their data while assisting buyers in discovering relevant datasets. The major challenge such a marketplace faces is balancing between offering valuable insights into data while preserving privacy requirements. Private data marketplaces try to solve this challenge by offering privacy-preserving computations on personal data. Such computations allow for calculating statistics or training machine learning models on personal data without accessing the data in plain. However, the user selling the data cannot restrict who can buy or what type of computation the data is allowed.",0.54,0.6,0.51,0.51,0.59,0.6,6.33,2.5,2.5,2.5,4.8
https://openalex.org/W4292158646,MalRec: A Blockchain-based Malware Recovery Framework for Internet of Things,ARES (Validação DBLP),"Ahmed Lekssays, Giorgia Sirigu, Barbara Carminati, Elena Ferrari",2022,"IoT devices have been considered an attractive target for malware (e.g., botnets) due to their low computational resources and lack of security measures. The literature focuses on detecting malware, but less attention is given to recovery solutions. In addition, with the development of data processing regulations in different countries, a need for transparent recovery systems that can help organizations present their due diligence arises. This work proposes a blockchain-based backup policy enforcement framework for IoT where an organization can formalize backup policies and enforce them. We have run our solution under extensive tests that show that it can be deployed in real-life IoT environments, despite the limited computational resources of IoT devices.",0,0,"MalRec: A Blockchain-based Malware Recovery Framework for Internet of Things IoT devices have been considered an attractive target for malware (e.g., botnets) due to their low computational resources and lack of security measures. The literature focuses on detecting malware, but less attention is given to recovery solutions. In addition, with the development of data processing regulations in different countries, a need for transparent recovery systems that can help organizations present their due diligence arises. This work proposes a blockchain-based backup policy enforcement framework for IoT where an organization can formalize backup policies and enforce them. We have run our solution under extensive tests that show that it can be deployed in real-life IoT environments, despite the limited computational resources of IoT devices.",0.56,0.68,0.65,0.59,0.6,0.68,8.0,0.0,0.0,0.0,4.8
https://openalex.org/W4300504117,Handling Critical Infrastructures in Federation of Cyber Ranges: A Classification Model,ARES (Validação DBLP),"Evangelos Chaskos, Jason Diakoumakos, Nicholas Kolokotronis, George Lepouras",2022,"A novel system is presented in this paper, which is able to classify the different components that comprise a Federation Cyber Range (FCR) platform in terms of their criticality level and thus maximize the sharing capabilities of environments that include critical infrastructures as part of their scenarios. A characterization method is proposed in order to share the requested information amongst the cyber ranges part of a federation platform with respect to the criticality level of each unique system, lying under a scenario. The proposed model is able to correctly categorize systems based on their criticality level that are part of a scenario, conceal information, evaluate the trust level of any partner and produce and distribute reusable scenarios, according to designated markings. Mechanisms to perform an overall evaluation to the resulting scenario regarding its pliability, reusability and its evaluation aspects are to be considered. This model describes a dynamic and scalable system, able to support security needs inside an FCR environment, hide critical information from non-eligible partners and dynamically create new public scenarios based on the existing ones, without alternating the initial educational objectives.",4,4,"Handling Critical Infrastructures in Federation of Cyber Ranges: A Classification Model A novel system is presented in this paper, which is able to classify the different components that comprise a Federation Cyber Range (FCR) platform in terms of their criticality level and thus maximize the sharing capabilities of environments that include critical infrastructures as part of their scenarios. A characterization method is proposed in order to share the requested information amongst the cyber ranges part of a federation platform with respect to the criticality level of each unique system, lying under a scenario. The proposed model is able to correctly categorize systems based on their criticality level that are part of a scenario, conceal information, evaluate the trust level of any partner and produce and distribute reusable scenarios, according to designated markings. Mechanisms to perform an overall evaluation to the resulting scenario regarding its pliability, reusability and its evaluation aspects are to be considered. This model describes a dynamic and scalable system, able to support security needs inside an FCR environment, hide critical information from non-eligible partners and dynamically create new public scenarios based on the existing ones, without alternating the initial educational objectives.",0.63,0.56,0.53,0.63,0.6,0.63,7.0,1.43,1.43,1.43,4.77
https://openalex.org/W4400976795,DECEPTWIN: Proactive Security Approach for IoV by Leveraging Deception-based Digital Twins and Blockchain,ARES (Validação DBLP),"Mubashar Iqbal, Sabah Suhail, Raimundas Matulevičius",2024,"The proliferation of security threats in connected systems necessitates innovative approaches to enhance security resilience. The Internet of Vehicles (IoV) presents a rapidly evolving and interconnected ecosystem that raises unprecedented security challenges, including remote hijacking, data breaches, and unauthorized access. Digital Twin (DT) and blockchain-based deception can emerge as a promising approach to enhance the security of the IoV ecosystem by creating a secure, realistic, dynamic, and interactive deceptive environment that can deceive and disrupt malicious actors. In accordance with this, we propose a proactive security approach for IoV by leveraging DECEPtion-based digiTal tWins and blockchaIN (DECEPTWIN) that entails hunting for security threats and gaps in IoV security posture before an incident or breach occurs.",1,1,"DECEPTWIN: Proactive Security Approach for IoV by Leveraging Deception-based Digital Twins and Blockchain The proliferation of security threats in connected systems necessitates innovative approaches to enhance security resilience. The Internet of Vehicles (IoV) presents a rapidly evolving and interconnected ecosystem that raises unprecedented security challenges, including remote hijacking, data breaches, and unauthorized access. Digital Twin (DT) and blockchain-based deception can emerge as a promising approach to enhance the security of the IoV ecosystem by creating a secure, realistic, dynamic, and interactive deceptive environment that can deceive and disrupt malicious actors. In accordance with this, we propose a proactive security approach for IoV by leveraging DECEPtion-based digiTal tWins and blockchaIN (DECEPTWIN) that entails hunting for security threats and gaps in IoV security posture before an incident or breach occurs.",0.59,0.65,0.58,0.51,0.56,0.65,7.67,0.36,0.36,0.36,4.74
https://openalex.org/W4400976698,"The Cyber Safe Position: An STPA for Safety, Security, and Resilience Co-Engineering Approach",ARES (Validação DBLP),"Georgios Gkoktsis, L. Peters",2024,"Model Based Security Engineering (MBSE) is a growing field of research, which is gaining popularity in the domain of Safety, Security, and Resilience Co-Engineering. The System Theoretic Process Analysis (STPA) is a method for systematically analyzing the behavior of complex systems to investigate their failure modes and the Unsafe Control Actions (UCA) that can lead to those failure modes. This paper expands the methodological scope of STPA, by including an iterative Root-Cause Analysis element, which examines the possible emergence of UCAs due to either malfunction, or malicious action. Output of the method are the attributes and constraints of Resilience Modes of system configuration and operation, named ”Cyber Safe Position“ (CSP). The proposed method is applied in the case study of a Photovoltaic Plant connected to a Virtual Power Plant (VPP).",2,2,"The Cyber Safe Position: An STPA for Safety, Security, and Resilience Co-Engineering Approach Model Based Security Engineering (MBSE) is a growing field of research, which is gaining popularity in the domain of Safety, Security, and Resilience Co-Engineering. The System Theoretic Process Analysis (STPA) is a method for systematically analyzing the behavior of complex systems to investigate their failure modes and the Unsafe Control Actions (UCA) that can lead to those failure modes. This paper expands the methodological scope of STPA, by including an iterative Root-Cause Analysis element, which examines the possible emergence of UCAs due to either malfunction, or malicious action. Output of the method are the attributes and constraints of Resilience Modes of system configuration and operation, named ”Cyber Safe Position“ (CSP). The proposed method is applied in the case study of a Photovoltaic Plant connected to a Virtual Power Plant (VPP).",0.64,0.52,0.52,0.6,0.57,0.64,7.33,0.71,0.71,0.71,4.68
https://openalex.org/W4300836756,"Secret sharing a key in a distributed way, Lagrange vs Newton",ARES (Validação DBLP),"Anastassios Voudouris, Ilias Politis, Christos Xenakis",2022,"In secret sharing, a dealer knows the secret it shares. In a distributed key generation (DKG) protocol, a shared secret is collectively generated in a group in a completely distributed way such that any subset of size greater than a threshold can reveal or use the shared secret, while smaller subsets do not have any knowledge about it. The most important aspect is that there is no dealer or trusted party. The core idea of secret sharing schemes is Shamir’s secret sharing method, which uses Lagrange’s interpolation to reconstruct the shared secret key. This paper investigates an alternative method, called Newton’s interpolation and it cites the probability of implementing it on current DKG protocols.",6,6,"Secret sharing a key in a distributed way, Lagrange vs Newton In secret sharing, a dealer knows the secret it shares. In a distributed key generation (DKG) protocol, a shared secret is collectively generated in a group in a completely distributed way such that any subset of size greater than a threshold can reveal or use the shared secret, while smaller subsets do not have any knowledge about it. The most important aspect is that there is no dealer or trusted party. The core idea of secret sharing schemes is Shamir’s secret sharing method, which uses Lagrange’s interpolation to reconstruct the shared secret key. This paper investigates an alternative method, called Newton’s interpolation and it cites the probability of implementing it on current DKG protocols.",0.48,0.62,0.47,0.52,0.62,0.62,6.33,2.14,2.14,2.14,4.66
https://openalex.org/W4302797317,Evaluating The Cyber-Security Culture of the EPES Sector,ARES (Validação DBLP),"Anna Georgiadou, Ariadni Michalitsi-Psarrou, Dimitris Askounis",2022,"The Energy Sector is highly targeted by cyber threats because of its inherent value and profitability. Recent reported security incidents verify its key playing role in the entire economic and societal concurrent reality. This paper aims to assess the cyber-security culture status of European representatives in the entire electrical power supply chain during the coronavirus pandemic and the Ukrainian war. An evaluation campaign has been carefully designed and held from 3rd March 2022 to 18th March 2022. During that period, participants from different Electrical Power and Energy Systems (EPES) organizations participated in the campaign. Gathered results were analyzed and co-examined using different techniques revealing important findings regarding the cyber-security status and resilience of individuals and organizations in the European EPES sector.",7,7,"Evaluating The Cyber-Security Culture of the EPES Sector The Energy Sector is highly targeted by cyber threats because of its inherent value and profitability. Recent reported security incidents verify its key playing role in the entire economic and societal concurrent reality. This paper aims to assess the cyber-security culture status of European representatives in the entire electrical power supply chain during the coronavirus pandemic and the Ukrainian war. An evaluation campaign has been carefully designed and held from 3rd March 2022 to 18th March 2022. During that period, participants from different Electrical Power and Energy Systems (EPES) organizations participated in the campaign. Gathered results were analyzed and co-examined using different techniques revealing important findings regarding the cyber-security status and resilience of individuals and organizations in the European EPES sector.",0.63,0.52,0.5,0.51,0.51,0.63,6.0,2.5,2.5,2.5,4.6
https://openalex.org/W4385688070,Linux-based IoT Benchmark Generator For Firmware Security Analysis Tools,ARES (Validação DBLP),"Dairo de Ruck, Victor Goeman, Michiel Willocx, Jorn Lapon, Vincent Naessens",2023,"There is a growing interest of IoT manufacturers to incorporate firmware analysis tools in their development pipeline to evaluate the security of new embedded devices. This has the advantage of discovering security issues before the device is marketed. However, each device has its own design, including different architectures, services and communication protocols, programmed and configured in different programming languages. This diversity results in potentially complete categories of vulnerabilities discarded by the firmware security analysis tools. Hence, a positive outcome of such tools may result in incorrect conclusions.",4,4,"Linux-based IoT Benchmark Generator For Firmware Security Analysis Tools There is a growing interest of IoT manufacturers to incorporate firmware analysis tools in their development pipeline to evaluate the security of new embedded devices. This has the advantage of discovering security issues before the device is marketed. However, each device has its own design, including different architectures, services and communication protocols, programmed and configured in different programming languages. This diversity results in potentially complete categories of vulnerabilities discarded by the firmware security analysis tools. Hence, a positive outcome of such tools may result in incorrect conclusions.",0.53,0.5,0.62,0.53,0.52,0.62,6.67,1.43,1.43,1.43,4.57
https://openalex.org/W4400977245,Immutability and non-repudiation in the exchange of key messages within the EU IoT-Edge-Cloud Continuum,ARES (Validação DBLP),"Salvador Cuñat, Raúl Reinosa, Ignacio Lacalle, Carlos E. Palau",2024,"The work reflects about the importance of trust in data exchanges in the context of ever-increasing distributed computing ecosystems. It proposes the utilisation of an open-source technology that implements a direct acyclic graph incorporating peer nodes to validate messages in a decentralised network. The tool, IOTA, promises to solve the hindrances of blockchain solutions in highly heterogeneous, IoT-assimilable scenarios, adopting a more lightweight approach, removing the need of mining. The article explores the functioning of IOTA in distributed computing continuum cases, understanding the figures and mechanisms that govern the process. The authors link those reflections to the direct transfer into a research project, aerOS, that uses such a tool as intrinsic part of an IoT-Edge-Cloud continuum framework, enabling the immutability and non-repudiation of key messages in such environments. Also, the authors conclude analysing which next steps might follow to evolve from a not-fully decentralised implementation with the next releases of the tool, and the adaptations for the studied application.",1,1,"Immutability and non-repudiation in the exchange of key messages within the EU IoT-Edge-Cloud Continuum The work reflects about the importance of trust in data exchanges in the context of ever-increasing distributed computing ecosystems. It proposes the utilisation of an open-source technology that implements a direct acyclic graph incorporating peer nodes to validate messages in a decentralised network. The tool, IOTA, promises to solve the hindrances of blockchain solutions in highly heterogeneous, IoT-assimilable scenarios, adopting a more lightweight approach, removing the need of mining. The article explores the functioning of IOTA in distributed computing continuum cases, understanding the figures and mechanisms that govern the process. The authors link those reflections to the direct transfer into a research project, aerOS, that uses such a tool as intrinsic part of an IoT-Edge-Cloud continuum framework, enabling the immutability and non-repudiation of key messages in such environments. Also, the authors conclude analysing which next steps might follow to evolve from a not-fully decentralised implementation with the next releases of the tool, and the adaptations for the studied application.",0.59,0.73,0.66,0.62,0.69,0.73,7.33,0.36,0.36,0.36,4.54
https://openalex.org/W4400977329,Multimodal Security Mechanisms for Critical Time Systems using blockchain in Chriss project,ARES (Validação DBLP),"Mari-Anais Sachian, George Suciu, Maria Niculae, Adrian Florin Păun, Petrică Ciotîrnae, Ivan Horatiu, Cristina Tudor, Robert Florescu",2024,"Abstract - This paper presents an in-depth description of a multi-modal security solution based on a blockchain architecture developed within the CHRISS (Critical infrastructure High accuracy and Robustness increase Integrated Synchronization Solutions) project. Specifically, the focus in the paper is on the description of the proposed security architecture, functionalities and security measures based on modern blockchain solutions developed for the CHRISS project.",1,1,"Multimodal Security Mechanisms for Critical Time Systems using blockchain in Chriss project Abstract - This paper presents an in-depth description of a multi-modal security solution based on a blockchain architecture developed within the CHRISS (Critical infrastructure High accuracy and Robustness increase Integrated Synchronization Solutions) project. Specifically, the focus in the paper is on the description of the proposed security architecture, functionalities and security measures based on modern blockchain solutions developed for the CHRISS project.",0.66,0.69,0.54,0.62,0.66,0.69,7.33,0.36,0.36,0.36,4.54
https://openalex.org/W4400976790,A Multi-layer Approach through Threat Modelling and Attack Simulation for Enhanced Cyber Security Assessment,ARES (Validação DBLP),"Eider Iturbe, Javier Arcas-Ruiz-Ruano, Erkuden Rios, Nerea Toledo",2024,"There is a growing concern about the dynamic landscape of cyber security threats escalating, and the need for improvement in defence capabilities against emerging sophisticated incidents. In response, this paper presents a solution called the Cyber Incident Simulation System, which enables system security engineers to simulate cyber-physical attacks and incidents without the requirement to affect or disrupt the ongoing business operation of the system. Leveraging graph-based threat modelling and AI-generated incident data, the system empowers professionals to predict the effect of the incident within the system under study. The synthetic data is used by anomaly-based Intrusion Detection Systems (IDSs) and other additional security controls to improve their detection algorithms to enhance their accuracy and effectiveness. The Cyber Incident Simulation System is designed to enhance the cyber security measures through the simulation of various incident scenarios.",2,2,"A Multi-layer Approach through Threat Modelling and Attack Simulation for Enhanced Cyber Security Assessment There is a growing concern about the dynamic landscape of cyber security threats escalating, and the need for improvement in defence capabilities against emerging sophisticated incidents. In response, this paper presents a solution called the Cyber Incident Simulation System, which enables system security engineers to simulate cyber-physical attacks and incidents without the requirement to affect or disrupt the ongoing business operation of the system. Leveraging graph-based threat modelling and AI-generated incident data, the system empowers professionals to predict the effect of the incident within the system under study. The synthetic data is used by anomaly-based Intrusion Detection Systems (IDSs) and other additional security controls to improve their detection algorithms to enhance their accuracy and effectiveness. The Cyber Incident Simulation System is designed to enhance the cyber security measures through the simulation of various incident scenarios.",0.63,0.51,0.52,0.52,0.56,0.63,7.0,0.71,0.71,0.71,4.49
https://openalex.org/W4385688102,IoT Security Seminar: Raising Awareness and Sharing Critical Knowledge,ARES (Validação DBLP),"Victor Goeman, Dairo de Ruck, Ilse Bohé, Jorn Lapon, Vincent Naessens",2023,"The security of the Internet of Things (IoT) devices has become a major concern as the number of connected devices continues to increase. Despite this concern, there is a lack of training opportunities to educate IoT developers on security measures. While there are ample ICT and Network Management courses for developers, there is a lack of security courses scoped for this audience. One of the reasons is that raising cybersecurity awareness and increasing the security expertise of developers presents a significant challenge due to the complexity of IoT security.",4,4,"IoT Security Seminar: Raising Awareness and Sharing Critical Knowledge The security of the Internet of Things (IoT) devices has become a major concern as the number of connected devices continues to increase. Despite this concern, there is a lack of training opportunities to educate IoT developers on security measures. While there are ample ICT and Network Management courses for developers, there is a lack of security courses scoped for this audience. One of the reasons is that raising cybersecurity awareness and increasing the security expertise of developers presents a significant challenge due to the complexity of IoT security.",0.53,0.51,0.62,0.51,0.52,0.62,6.5,1.43,1.43,1.43,4.47
