id,title,venue,authors,year,abstract,citations,influential_citations,clean_text,CPS,Blockchain,IoT,Fault Tolerance,Distributed Systems,sim_max,S_Quali,C_Norm,V_Norm,S_Quant,Score_Global
https://openalex.org/W4413250257,Enhancing Cyber Situational Awareness with AI: A Novel Pipeline Approach for Threat Intelligence Analysis and Enrichment,ARES (Validação DBLP),"Dzenan Hamzic, Florian Skopik, Max Landauer, Markus Wurzenberger, Andreas Rauber",2025,"Abstract Cyber Situational Awareness (CSA) is crucial for understanding and anticipating developments across diverse domains. This paper introduces a novel approach employing advanced Artificial Intelligence (AI) and Natural Language Processing (NLP) techniques to effectively analyze and enrich Cyber Threat Intelligence (CTI) and Open Source Intelligence (OSINT) data. The paper designs an unified CTI and OSINT processing pipeline that integrates named entity recognition (NER), relationship extraction, classification, and summarization, addressing current limitations in CTI analysis. Notably, our evaluation of existing language models revealed significant shortcomings, with general-purpose tokenizers recognizing only 1.62% of specialized MITRE ATT&amp;CK terms. In contrast, our pipeline achieves superior performance, notably surpassing state-of-the-art models in some important aspects. Practical military and civilian scenarios further demonstrate the pipeline’s value in generating actionable intelligence, enabling complex reasoning by combining symbolic knowledge graphs and semantic vector search methods. Future developments focus on refining model scalability and enhancing analytical capabilities to increase the effectiveness, efficiency, and applicability of our approach.",2,2,"Enhancing Cyber Situational Awareness with AI: A Novel Pipeline Approach for Threat Intelligence Analysis and Enrichment Abstract Cyber Situational Awareness (CSA) is crucial for understanding and anticipating developments across diverse domains. This paper introduces a novel approach employing advanced Artificial Intelligence (AI) and Natural Language Processing (NLP) techniques to effectively analyze and enrich Cyber Threat Intelligence (CTI) and Open Source Intelligence (OSINT) data. The paper designs an unified CTI and OSINT processing pipeline that integrates named entity recognition (NER), relationship extraction, classification, and summarization, addressing current limitations in CTI analysis. Notably, our evaluation of existing language models revealed significant shortcomings, with general-purpose tokenizers recognizing only 1.62% of specialized MITRE ATT&CK terms. In contrast, our pipeline achieves superior performance, notably surpassing state-of-the-art models in some important aspects. Practical military and civilian scenarios further demonstrate the pipeline’s value in generating actionable intelligence, enabling complex reasoning by combining symbolic knowledge graphs and semantic vector search methods. Future developments focus on refining model scalability and enhancing analytical capabilities to increase the effectiveness, efficiency, and applicability of our approach.",0.61,0.51,0.52,0.52,0.53,0.61,8.0,0.71,0.71,0.71,5.09
https://openalex.org/W4400976737,"Evaluation of Cyber Situation Awareness - Theory, Techniques and Applications",ARES (Validação DBLP),"Georgi Nikolov, Axelle Perez, Wim Mees",2024,"In recent years the technology field has grown exponentially, bringing with it new possibilities, but also new threats. This rapid advancement has created fertile grounds for new sophisticated cyber attacks, exhibiting a high degree of complexity. In an ever evolving cyber landscape, organizations need to dedicate valuable resources in enhancing their understanding of emergent threats for the purposes of identification, analysis and mitigation. To accomplish this task, they rely on Cyber Situation Awareness (CSA), a framework designed for the purposes of managing the virtual environment. This is achieved through the perception and comprehension of the behaviors therein, be that benign or malicious, followed by modeling the future state of the environment based on the gathered information. In this paper, we will discuss how exactly the theory of Situation Awareness has been applied to the cyber domain. Further on, we will present various techniques used for handling the large quantity of complex data and managing the dynamic nature of the environment by Cyber Situation Operation Centers (CSOC) and discuss in detail a number of methodologies that have been designed for the evaluation of the level of CSA. Finally, we will provide specific examples of simulated scenarios for the application of the CSA assessment techniques.",4,4,"Evaluation of Cyber Situation Awareness - Theory, Techniques and Applications In recent years the technology field has grown exponentially, bringing with it new possibilities, but also new threats. This rapid advancement has created fertile grounds for new sophisticated cyber attacks, exhibiting a high degree of complexity. In an ever evolving cyber landscape, organizations need to dedicate valuable resources in enhancing their understanding of emergent threats for the purposes of identification, analysis and mitigation. To accomplish this task, they rely on Cyber Situation Awareness (CSA), a framework designed for the purposes of managing the virtual environment. This is achieved through the perception and comprehension of the behaviors therein, be that benign or malicious, followed by modeling the future state of the environment based on the gathered information. In this paper, we will discuss how exactly the theory of Situation Awareness has been applied to the cyber domain. Further on, we will present various techniques used for handling the large quantity of complex data and managing the dynamic nature of the environment by Cyber Situation Operation Centers (CSOC) and discuss in detail a number of methodologies that have been designed for the evaluation of the level of CSA. Finally, we will provide specific examples of simulated scenarios for the application of the CSA assessment techniques.",0.65,0.5,0.54,0.55,0.57,0.65,7.5,1.43,1.43,1.43,5.07
https://openalex.org/W4293023532,Cyber-security measures for protecting EPES systems in the 5G area,ARES (Validação DBLP),Alexios Lekidis,2022,"The recent technological advance in the fifth generation of telecommunication networks (5G) has led to a evolutions in many domains, including connected cars, manufacturing and electricity. A technological domain that had large benefits from this advance is the Electrical Power and Energy System (EPES). Despite the simplicity and efficiency that 5G brings there are also underlying risks that are slowing down its adoption. These risks are caused by the presence of convergence connectivity interfaces in legacy infrastructures that were built with no security in mind. Specifically, EPES systems are often targeted by cyber criminals to cause massive blackouts in entire cities or countries that in turn lead to societal impact, such as consumer discomfort. In this work we propose a cyber-security measures for 1) early-stage detection of cyber-security incidents and 2) protecting against them through applicable security measures. The proposed measures are applied to a Hydroelectric Power Plant (HPP) of the Public Power Corporation (PPC). The cyber-attacks are performed in a 5G-enabled smart meter that measures power production and transmits measurements to PPC's control center through the use of 5G Network Function Virtualization (NFV) technologies, such as network slicing. To protect against the attacks, cyber-security measures are applied and incorporated in a cyber-security platform, that was developed within the PHOENIX H2020 project. The measures are used to detect the attacks and perform necessary mitigation actions for restoring the HPP operation.",6,6,"Cyber-security measures for protecting EPES systems in the 5G area The recent technological advance in the fifth generation of telecommunication networks (5G) has led to a evolutions in many domains, including connected cars, manufacturing and electricity. A technological domain that had large benefits from this advance is the Electrical Power and Energy System (EPES). Despite the simplicity and efficiency that 5G brings there are also underlying risks that are slowing down its adoption. These risks are caused by the presence of convergence connectivity interfaces in legacy infrastructures that were built with no security in mind. Specifically, EPES systems are often targeted by cyber criminals to cause massive blackouts in entire cities or countries that in turn lead to societal impact, such as consumer discomfort. In this work we propose a cyber-security measures for 1) early-stage detection of cyber-security incidents and 2) protecting against them through applicable security measures. The proposed measures are applied to a Hydroelectric Power Plant (HPP) of the Public Power Corporation (PPC). The cyber-attacks are performed in a 5G-enabled smart meter that measures power production and transmits measurements to PPC's control center through the use of 5G Network Function Virtualization (NFV) technologies, such as network slicing. To protect against the attacks, cyber-security measures are applied and incorporated in a cyber-security platform, that was developed within the PHOENIX H2020 project. The measures are used to detect the attacks and perform necessary mitigation actions for restoring the HPP operation.",0.64,0.54,0.56,0.52,0.56,0.64,7.0,2.14,2.14,2.14,5.06
https://openalex.org/W4385688327,A Generic IoT Quantum-Safe Watchdog Timer Protocol,ARES (Validação DBLP),"Michael Eckel, T. Gutsche, Hagen Lauer, André Rein",2023,"This paper presents a quantum-safe watchdog timer protocol designed and implemented using various quantum-safe digital signature algorithms. The protocol is specifically tailored to be used in the context of the Internet of Things (IoT) to address the security risks posed by quantum computing to classical protocols. Our approach replaces the classical protocol with a quantum-safe watchdog timer protocol, which ensures that an IoT device’s communication channels remain secure from adversarial attacks.",6,6,"A Generic IoT Quantum-Safe Watchdog Timer Protocol This paper presents a quantum-safe watchdog timer protocol designed and implemented using various quantum-safe digital signature algorithms. The protocol is specifically tailored to be used in the context of the Internet of Things (IoT) to address the security risks posed by quantum computing to classical protocols. Our approach replaces the classical protocol with a quantum-safe watchdog timer protocol, which ensures that an IoT device’s communication channels remain secure from adversarial attacks.",0.54,0.61,0.64,0.6,0.59,0.64,7.0,2.14,2.14,2.14,5.06
https://openalex.org/W4400977581,A Blockchain-based Multi-Factor Honeytoken Dynamic Authentication Mechanism,ARES (Validação DBLP),"Vassilis Papaspirou, Ioanna Kantzavelou, Yagmur Yigit, Λέανδρος Μαγλαράς, Sokratis Katsikas",2024,"The evolution of authentication mechanisms in ensuring secure access to systems has been crucial for mitigating vulnerabilities and enhancing system security. However, despite advancements in two-factor authentication (2FA) and multi-factor authentication (MFA), authentication mechanisms remain weak in system security, particularly when individuals accessing critical systems are involved. In response to this challenge, we propose a novel blockchain-based multi-factor dynamic authentication mechanism (BMFA) that integrates honeytoken technology to enhance security. Our proposed mechanism leverages Ethereum blockchain technology and smart contracts to provide a decentralized and robust authentication framework. By incorporating honeytokens into smart contracts, we introduce a dynamic layer of security that continuously adapts to prevent potential attacks. Our evaluation demonstrates that our BMFA mechanism effectively addresses various security challenges, including brute force attacks, man-in-the-middle attacks, and smart contract vulnerabilities, while providing robust protection against unauthorized access. Our findings emphasise the efficacy of the BMFA mechanism in enhancing system security and mitigating evolving threats in authentication processes for next-generation critical industrial control systems.",3,3,"A Blockchain-based Multi-Factor Honeytoken Dynamic Authentication Mechanism The evolution of authentication mechanisms in ensuring secure access to systems has been crucial for mitigating vulnerabilities and enhancing system security. However, despite advancements in two-factor authentication (2FA) and multi-factor authentication (MFA), authentication mechanisms remain weak in system security, particularly when individuals accessing critical systems are involved. In response to this challenge, we propose a novel blockchain-based multi-factor dynamic authentication mechanism (BMFA) that integrates honeytoken technology to enhance security. Our proposed mechanism leverages Ethereum blockchain technology and smart contracts to provide a decentralized and robust authentication framework. By incorporating honeytokens into smart contracts, we introduce a dynamic layer of security that continuously adapts to prevent potential attacks. Our evaluation demonstrates that our BMFA mechanism effectively addresses various security challenges, including brute force attacks, man-in-the-middle attacks, and smart contract vulnerabilities, while providing robust protection against unauthorized access. Our findings emphasise the efficacy of the BMFA mechanism in enhancing system security and mitigating evolving threats in authentication processes for next-generation critical industrial control systems.",0.58,0.69,0.54,0.56,0.56,0.69,7.67,1.07,1.07,1.07,5.03
https://openalex.org/W4400976780,Open V2X Management Platform Cyber-Resilience and Data Privacy Mechanisms,ARES (Validação DBLP),"Alexios Lekidis, Hugo Morais",2024,"Vehicle-to-Everything (V2X) technologies have been recently introduced to provide enhanced connectivity between the different smart grid segments as well as Electric Vehicles (EVs). The EVs draw power to the grid and may be used as an energy flexibility resource for households and buildings. The increased number of interconnections though, is augmenting substantially the cyber-security and data privacy threats that may occur in the V2X ecosystem. In this paper, such threats are categorized into cyber-attack classes which serve as a basis for deriving Tactics, Techniques, and Procedures (TTPs) for the V2X ecosystem. Additionally, the sensitive data that are exchanged in charging and discharging scenarios are reviewed. Then, an analysis of the existing cyber-security mechanisms is provided and further mechanisms/tools are proposed for detecting/preventing the categorized threats, which are being developed in an Open V2X Management Platform (O-V2X-MP) within the EV4EU project. These mechanisms will provide security-by-design in O-V2X-MP, as well as ensure protection in the V2X interactions.",3,3,"Open V2X Management Platform Cyber-Resilience and Data Privacy Mechanisms Vehicle-to-Everything (V2X) technologies have been recently introduced to provide enhanced connectivity between the different smart grid segments as well as Electric Vehicles (EVs). The EVs draw power to the grid and may be used as an energy flexibility resource for households and buildings. The increased number of interconnections though, is augmenting substantially the cyber-security and data privacy threats that may occur in the V2X ecosystem. In this paper, such threats are categorized into cyber-attack classes which serve as a basis for deriving Tactics, Techniques, and Procedures (TTPs) for the V2X ecosystem. Additionally, the sensitive data that are exchanged in charging and discharging scenarios are reviewed. Then, an analysis of the existing cyber-security mechanisms is provided and further mechanisms/tools are proposed for detecting/preventing the categorized threats, which are being developed in an Open V2X Management Platform (O-V2X-MP) within the EV4EU project. These mechanisms will provide security-by-design in O-V2X-MP, as well as ensure protection in the V2X interactions.",0.64,0.6,0.58,0.55,0.56,0.64,7.67,1.07,1.07,1.07,5.03
https://openalex.org/W4301195673,Fault-Tolerant SDN Solution for Cybersecurity Applications,ARES (Validação DBLP),"Athanasios Liatifis, Christos Dalamagkas, Panagiotis Radoglou‐Grammatikis, Θωμάς Λάγκας, Evangelos Markakis, Valeri Mladenov, Panagiotis Sarigiannidis",2022,"The rapid growth of computer networks in various sectors has led to new services previously hard or impossible to implement. Internet of Things has also assisted in this evolution offering easy access to data but at the same time imposing constraints on both security and quality of service. In this paper, an SDN fault tolerant and resilient SDN controller design approach is presented. The proposed solution is suitable for a wide range of environments. Benefits stemming from actual scenarios are presented and discussed among other solutions.",7,7,"Fault-Tolerant SDN Solution for Cybersecurity Applications The rapid growth of computer networks in various sectors has led to new services previously hard or impossible to implement. Internet of Things has also assisted in this evolution offering easy access to data but at the same time imposing constraints on both security and quality of service. In this paper, an SDN fault tolerant and resilient SDN controller design approach is presented. The proposed solution is suitable for a wide range of environments. Benefits stemming from actual scenarios are presented and discussed among other solutions.",0.63,0.55,0.62,0.68,0.63,0.68,6.67,2.5,2.5,2.5,5.0
https://openalex.org/W4385688066,An inclusive Lifecycle Approach for IoT Devices Trust and Identity Management,ARES (Validação DBLP),"Konstantinos Loupos, Harris Niavis, Fotis Michalopoulos, George Misiakoulis, Antonio Skármeta, Jesús García-Rodríguez, Angel Palomares, Hui Song, Rustem Dautov, Francesca Giampaolo, Rosella Omana Mancilla, Francesca Costantino, Dimitri Van Landuyt, Sam Michiels, Stefan More, Christos Xenakis, Michail Bampatsikos, Ilias Politis, Konstantinos Krilakis, Sokratis Vavilis",2023,"ERATOSTHENES is an EC, co-funded, research project strongly considering modern security challenges in the domain of Internet of Things in mind of their huge penetration into our day to day lives. There are a series of recent challenges that recently have been converted into obstacles or risk points that could block the secure operation of IoT networks in all day to day activities, from home to office, to leisure and security. These include examples such as the highly increased number of connected devices (at all network levels) that are on top forming inhomogeneous networks and systems of systems. Different vendor characteristics further increase the attack surface that is expected to further rise in the upcoming years. Such, highly critical, characteristics, dramatically increase the needs for confidentiality access control, user and things’ privacy, devices’ trustworthiness and compliance that require lifecycle considerations. The ERATOSTHENES project orchestrates a novel distributed, automated, auditable, yet privacy-respectful, Trust and Identity Management Framework and Reference Architecture with the ultimate scope to dynamically and holistically manage IoT devices in a lifecycle approach, strengthening trust, identities, and resilience in the entire IoT ecosystem while supporting the enforcement of the NIS directive, GDPR and Cybersecurity Act. This publication describes the ERATOSTHENES technical concept and reference architecture as well as design considerations, architecture characteristics, connectivity and interoperability.",4,4,"An inclusive Lifecycle Approach for IoT Devices Trust and Identity Management ERATOSTHENES is an EC, co-funded, research project strongly considering modern security challenges in the domain of Internet of Things in mind of their huge penetration into our day to day lives. There are a series of recent challenges that recently have been converted into obstacles or risk points that could block the secure operation of IoT networks in all day to day activities, from home to office, to leisure and security. These include examples such as the highly increased number of connected devices (at all network levels) that are on top forming inhomogeneous networks and systems of systems. Different vendor characteristics further increase the attack surface that is expected to further rise in the upcoming years. Such, highly critical, characteristics, dramatically increase the needs for confidentiality access control, user and things’ privacy, devices’ trustworthiness and compliance that require lifecycle considerations. The ERATOSTHENES project orchestrates a novel distributed, automated, auditable, yet privacy-respectful, Trust and Identity Management Framework and Reference Architecture with the ultimate scope to dynamically and holistically manage IoT devices in a lifecycle approach, strengthening trust, identities, and resilience in the entire IoT ecosystem while supporting the enforcement of the NIS directive, GDPR and Cybersecurity Act. This publication describes the ERATOSTHENES technical concept and reference architecture as well as design considerations, architecture characteristics, connectivity and interoperability.",0.55,0.58,0.62,0.6,0.59,0.62,7.33,1.43,1.43,1.43,4.97
https://openalex.org/W4293023002,STRIPED: A Threat Analysis Method for IoT Systems,ARES (Validação DBLP),"Kamakshi Srikumar, Komal Kashish, Kolja Eggers, Nicolás E. Díaz Ferreyra, Julian Koch, Thorsten Schüppstuhl, Riccardo Scandariato",2022,"Currently, IoT systems display a poor level of security, as 50% of IoT devices are vulnerable to severe attacks, according to research. In an attempt to ameliorate the situation, we propose STRIPED, a threat analysis technique that focuses particularly on threat scenarios involving IoT devices that can be physically accessed by attackers. We evaluate STRIPED in a two-pronged way. First, we assess its performance compared to STRIDE (from which STRIPED is derived) in the context of a case study from the manufacturing industry. Second, we gather the feedback of 8 security experts working in a large, multinational company that specializes in secure IoT products for the domains of automotive, industrial, mobile and smart-home applications. These initial evaluation attempts provide encouraging evidence and suggest our method is a step in the right direction of facilitating security-by-design in IoT systems, especially industrial ones.",4,4,"STRIPED: A Threat Analysis Method for IoT Systems Currently, IoT systems display a poor level of security, as 50% of IoT devices are vulnerable to severe attacks, according to research. In an attempt to ameliorate the situation, we propose STRIPED, a threat analysis technique that focuses particularly on threat scenarios involving IoT devices that can be physically accessed by attackers. We evaluate STRIPED in a two-pronged way. First, we assess its performance compared to STRIDE (from which STRIPED is derived) in the context of a case study from the manufacturing industry. Second, we gather the feedback of 8 security experts working in a large, multinational company that specializes in secure IoT products for the domains of automotive, industrial, mobile and smart-home applications. These initial evaluation attempts provide encouraging evidence and suggest our method is a step in the right direction of facilitating security-by-design in IoT systems, especially industrial ones.",0.6,0.56,0.63,0.54,0.57,0.63,7.33,1.43,1.43,1.43,4.97
