id,title,venue,authors,year,abstract,citations,influential_citations,clean_text,CPS,Blockchain,IoT,Fault Tolerance,Distributed Systems,sim_max,S_Quali,C_Norm,V_Norm,S_Quant,Score_Global
https://openalex.org/W4292158200,ConSenseIoT: A Consensus Algorithm for Secure and Scalable Blockchain in the IoT context,ARES (Validação DBLP),"Harris Niavis, Konstantinos Loupos",2022,"Data protection and privacy is a major concern in the Internet of Things (IoT) ecosystem, and the excessive use of IoT devices may risk the security of the network. Blockchain solutions are used to enhance the trustworthiness and eliminate the need for trusted third parties by providing mechanisms to reach consensus in a network of trustless participants. The consensus algorithms employed by blockchain architectures ensure the integrity of the data stored in the blockchain, the resiliency of the network and manage the security of devices. However, current solutions are compute intensive affecting the performance of the network and consuming much energy. In this work, we introduce a consensus algorithm for offering secure distributed consensus among IoT devices without affecting the performance of the network. The algorithm is inspired by existing solutions, employs decentralised identities, verifiable credentials and a decentralised trust management mechanism to guarantee security, privacy and trustworthiness of transactions. Finally, our algorithm combines technologies for operating in a distributed manner which favors the scalability and allow the effective integration in large scale networks.",8,8,"ConSenseIoT: A Consensus Algorithm for Secure and Scalable Blockchain in the IoT context Data protection and privacy is a major concern in the Internet of Things (IoT) ecosystem, and the excessive use of IoT devices may risk the security of the network. Blockchain solutions are used to enhance the trustworthiness and eliminate the need for trusted third parties by providing mechanisms to reach consensus in a network of trustless participants. The consensus algorithms employed by blockchain architectures ensure the integrity of the data stored in the blockchain, the resiliency of the network and manage the security of devices. However, current solutions are compute intensive affecting the performance of the network and consuming much energy. In this work, we introduce a consensus algorithm for offering secure distributed consensus among IoT devices without affecting the performance of the network. The algorithm is inspired by existing solutions, employs decentralised identities, verifiable credentials and a decentralised trust management mechanism to guarantee security, privacy and trustworthiness of transactions. Finally, our algorithm combines technologies for operating in a distributed manner which favors the scalability and allow the effective integration in large scale networks.",0.58,0.71,0.66,0.59,0.69,0.71,7.67,2.86,2.86,2.86,5.74
https://openalex.org/W4385688044,Multi-Attribute Decision Making-based Trust Score Calculation in Trust Management in IoT,ARES (Validação DBLP),"Michail Bampatsikos, Ilias Politis, Vaios Bolgouras, Christos Xenakis",2023,"The proliferation of IoT networks across various sectors necessitates robust Trust Management mechanisms for secure and reliable operations. This paper proposes a Multi-Attribute Decision Making (MADM)-based approach for trust score calculation in IoT Trust Management. This solution addresses limitations of existing methods by considering multiple attributes and providing a comprehensive evaluation of trustworthiness. The methodology computes a device's trust score by integrating factors such as Cyber Risk, Ease of Access, and Security Level using a weighted sum-based calculation. The Analytical Hierarchy Process (AHP) to determine the factors’ weights is utilized, contributing a novel approach to IoT Trust Management. Furthermore, this approach includes dynamic trust score updates throughout the device's lifetime, accommodating changes in the device's Cyber Risk for accurate trust assessment. A trust score penalization mechanism for devices below a predefined threshold is also introduced, enabling prompt risk mitigation. A simulated assessment, considering varying numbers of IoT devices, evaluates the effectiveness of the proposed methodology. By addressing limitations and introducing innovative components, the proposed MADM-based approach enhances security, reliability, and overall performance of IoT networks. This research advances trust management in IoT and provides valuable insights for developing secure and trustworthy IoT ecosystems.",5,5,"Multi-Attribute Decision Making-based Trust Score Calculation in Trust Management in IoT The proliferation of IoT networks across various sectors necessitates robust Trust Management mechanisms for secure and reliable operations. This paper proposes a Multi-Attribute Decision Making (MADM)-based approach for trust score calculation in IoT Trust Management. This solution addresses limitations of existing methods by considering multiple attributes and providing a comprehensive evaluation of trustworthiness. The methodology computes a device's trust score by integrating factors such as Cyber Risk, Ease of Access, and Security Level using a weighted sum-based calculation. The Analytical Hierarchy Process (AHP) to determine the factors’ weights is utilized, contributing a novel approach to IoT Trust Management. Furthermore, this approach includes dynamic trust score updates throughout the device's lifetime, accommodating changes in the device's Cyber Risk for accurate trust assessment. A trust score penalization mechanism for devices below a predefined threshold is also introduced, enabling prompt risk mitigation. A simulated assessment, considering varying numbers of IoT devices, evaluates the effectiveness of the proposed methodology. By addressing limitations and introducing innovative components, the proposed MADM-based approach enhances security, reliability, and overall performance of IoT networks. This research advances trust management in IoT and provides valuable insights for developing secure and trustworthy IoT ecosystems.",0.57,0.56,0.62,0.56,0.54,0.62,8.0,1.79,1.79,1.79,5.51
https://openalex.org/W4385713418,Interactive Environment for Effective Cybersecurity Teaching and Learning,ARES (Validação DBLP),"Willi Lazarov, Tomas Stodulka, Tiina Schafeitel‐Tähtinen, Marko Helenius, Zdeněk Martinásek",2023,"Cybersecurity affects all users to some extent, and it is essential to raise awareness about potential cybersecurity risks and improve practical skills from an early stage of their education. This paper addresses these aspects and discusses the research, design, and implementation of a platform for effective cybersecurity teaching and learning. Our main contribution is the creation of an interactive environment with the easy-to-use execution and management of educational and training scenarios. Our solution is tailored for multi-level education, as well as small to medium-sized institutions, and we have validated its effectiveness through several test sessions conducted with university and high school students. In addition, the paper presents selected preliminary results from the testing performed and an overall evaluation of the environment.",10,10,"Interactive Environment for Effective Cybersecurity Teaching and Learning Cybersecurity affects all users to some extent, and it is essential to raise awareness about potential cybersecurity risks and improve practical skills from an early stage of their education. This paper addresses these aspects and discusses the research, design, and implementation of a platform for effective cybersecurity teaching and learning. Our main contribution is the creation of an interactive environment with the easy-to-use execution and management of educational and training scenarios. Our solution is tailored for multi-level education, as well as small to medium-sized institutions, and we have validated its effectiveness through several test sessions conducted with university and high school students. In addition, the paper presents selected preliminary results from the testing performed and an overall evaluation of the environment.",0.61,0.52,0.5,0.53,0.55,0.61,6.5,3.57,3.57,3.57,5.33
https://openalex.org/W4400977099,A Model-based Approach for Assessing the Security of Cyber-Physical Systems,ARES (Validação DBLP),"Hugo Teixeira De Castro, Ahmed Hussain, Grégory Blanc, Jamal El Hachem, Dominique Blouin, Jean Leneutre, Panos Papadimitratos",2024,"Cyber-Physical Systems (CPSs) complexity has been continuously increasing to support new life-impacting applications, such as Internet of Things (IoT) devices or Industrial Control Systems (ICSs). These characteristics introduce new critical security challenges to both industrial practitioners and academics. This work investigates how Model-Based System Engineering (MBSE) and attack graph approaches could be leveraged to model secure Cyber-Physical System solutions and identify high-impact attacks early in the system development life cycle. To achieve this, we propose a new framework that comprises (1) an easily adoptable modeling paradigm for Cyber-Physical System representation, (2) an attack-graph-based solution for Cyber-Physical System automatic quantitative security analysis, based on the MulVAL security tool, (3) a set of Model-To-Text (MTT) transformation rules to bridge the gap between SysML and MulVAL. We illustrated the validity of our proposed framework through an autonomous ventilation system example. A Denial of Service (DoS) attack targeting an industrial communication protocol was identified and displayed as attack graphs. In future work, we intend to connect the approach to dynamic security databases for automatic countermeasure selection.",5,5,"A Model-based Approach for Assessing the Security of Cyber-Physical Systems Cyber-Physical Systems (CPSs) complexity has been continuously increasing to support new life-impacting applications, such as Internet of Things (IoT) devices or Industrial Control Systems (ICSs). These characteristics introduce new critical security challenges to both industrial practitioners and academics. This work investigates how Model-Based System Engineering (MBSE) and attack graph approaches could be leveraged to model secure Cyber-Physical System solutions and identify high-impact attacks early in the system development life cycle. To achieve this, we propose a new framework that comprises (1) an easily adoptable modeling paradigm for Cyber-Physical System representation, (2) an attack-graph-based solution for Cyber-Physical System automatic quantitative security analysis, based on the MulVAL security tool, (3) a set of Model-To-Text (MTT) transformation rules to bridge the gap between SysML and MulVAL. We illustrated the validity of our proposed framework through an autonomous ventilation system example. A Denial of Service (DoS) attack targeting an industrial communication protocol was identified and displayed as attack graphs. In future work, we intend to connect the approach to dynamic security databases for automatic countermeasure selection.",0.73,0.51,0.56,0.56,0.58,0.73,7.67,1.79,1.79,1.79,5.32
https://openalex.org/W4400976748,Towards the adoption of automated cyber threat intelligence information sharing with integrated risk assessment,ARES (Validação DBLP),"Valeria Valdés, Fatiha Zaïdi, Ana Cavalli, Angel Rego",2024,"In the domain of cybersecurity, effective threat intelligence and information sharing are critical operations for ensuring appropriate and timely response against threats, but limited in automation, standardization, and ease of use in current platforms. This paper introduces a Cyber Threat Intelligence (CTI) Information Sharing platform, designed for critical infrastructures and cyber-physical systems. Our platform integrates existing cybersecurity tools and leverages digital twin technology, enhancing threat analysis and mitigation capabilities. It features an automated process for disseminating standardized and structured intelligence, utilizing the Malware Information Sharing Platform (MISP) for effective dissemination. A significant enhancement is the integration of risk assessment tools, which enriches the shared intelligence with detailed risk information, supporting an informed decision-making. The platform encompasses a user-friendly dashboard and a robust backend, streamlining the threat intelligence cycle and transforming raw data coming from diverse sources into actionable insights. Overall the CTI4BC platform presents a solution to overcome challenges in the CTI sharing, contributing to a more resilient cybersecurity domain.",5,5,"Towards the adoption of automated cyber threat intelligence information sharing with integrated risk assessment In the domain of cybersecurity, effective threat intelligence and information sharing are critical operations for ensuring appropriate and timely response against threats, but limited in automation, standardization, and ease of use in current platforms. This paper introduces a Cyber Threat Intelligence (CTI) Information Sharing platform, designed for critical infrastructures and cyber-physical systems. Our platform integrates existing cybersecurity tools and leverages digital twin technology, enhancing threat analysis and mitigation capabilities. It features an automated process for disseminating standardized and structured intelligence, utilizing the Malware Information Sharing Platform (MISP) for effective dissemination. A significant enhancement is the integration of risk assessment tools, which enriches the shared intelligence with detailed risk information, supporting an informed decision-making. The platform encompasses a user-friendly dashboard and a robust backend, streamlining the threat intelligence cycle and transforming raw data coming from diverse sources into actionable insights. Overall the CTI4BC platform presents a solution to overcome challenges in the CTI sharing, contributing to a more resilient cybersecurity domain.",0.61,0.54,0.5,0.55,0.53,0.61,7.67,1.79,1.79,1.79,5.32
https://openalex.org/W4385688101,PRAETORIAN: A Framework for the Protection of Critical Infrastructures from advanced Combined Cyber and Physical Threats,ARES (Validação DBLP),"Lazaros Papadopoulos, Antonios Karteris, Dimitrios Soudris, Eva Muñoz, Juan José Hernández-Montesinos, Stéphane Paul, Nicolas Museux, Sandra Kuenig, Manuel Egger, Stefan Schauer, Javier Hingant, Tamara Hadjina",2023,"Combined cyber and physical attacks on Critical Infrastructures have disastrous consequences on economies and in social well-being. Protection and resilience of CIs under combined attacks is challenging due to their complexity, reliance on ICT systems and the interdependences between different types of CIs. The PRAETORIAN framework was designed to address these challenges, by integrating components responsible for detecting both cyber and physical threats. Additionally, it forecasts how the combined attacks will evolve and their cascading effects on interdependent CIs. The PRAETORIAN framework was demonstrated based on a realistic scenario in the Zagreb airport, combining both physical and cyber attacks.",3,3,"PRAETORIAN: A Framework for the Protection of Critical Infrastructures from advanced Combined Cyber and Physical Threats Combined cyber and physical attacks on Critical Infrastructures have disastrous consequences on economies and in social well-being. Protection and resilience of CIs under combined attacks is challenging due to their complexity, reliance on ICT systems and the interdependences between different types of CIs. The PRAETORIAN framework was designed to address these challenges, by integrating components responsible for detecting both cyber and physical threats. Additionally, it forecasts how the combined attacks will evolve and their cascading effects on interdependent CIs. The PRAETORIAN framework was demonstrated based on a realistic scenario in the Zagreb airport, combining both physical and cyber attacks.",0.65,0.54,0.52,0.54,0.54,0.65,8.0,1.07,1.07,1.07,5.23
https://openalex.org/W4400977420,A tool for IoT Firmware Certification,ARES (Validação DBLP),"Giuseppe Marco Bianco, Luca Ardito, Michele Valsesia",2024,"The rapid growth of the Internet of Things (IoT) has created a fragmented ecosystem, with no clear rules for security and reliability. This lack of standardization makes IoT devices vulnerable to attacks. IoT firmware certification can address these security concerns. It empowers consumers to make informed choices by readily identifying secure products. Additionally, it incentivizes developers to prioritize secure coding practices, ultimately promoting transparency and trust within the IoT ecosystem. Several existing IoT device certifications (e.g. Cybersecurity Assurance Program, British Standards Institution, ioXt Alliance) prioritise cybersecurity through risk and vulnerability assessments. This paper proposes a complementary approach. Our tool focuses on identifying firmware functionality by analysing system calls through static analysis. This allows to publicly identify APIs to assess the actual behaviour of a firmware. The analysis culminates in the generation of JSON manifests, which encapsulate the relevant information gathered during the case study. In particular, this analysis verifies whether the actual behaviour is in line with the developer’s statements about the device’s functionality, contributing to the security and reliability of a device. To evaluate tool’s performance, we conducted a benchmarking analysis which has demonstrated efficient handling of binaries written in various languages, even those with large file sizes. Future will be based on refining the API search and syscall collection algorithms, other than incorporating vulnerability analysis to further strengthen the security of an IoT device.",4,4,"A tool for IoT Firmware Certification The rapid growth of the Internet of Things (IoT) has created a fragmented ecosystem, with no clear rules for security and reliability. This lack of standardization makes IoT devices vulnerable to attacks. IoT firmware certification can address these security concerns. It empowers consumers to make informed choices by readily identifying secure products. Additionally, it incentivizes developers to prioritize secure coding practices, ultimately promoting transparency and trust within the IoT ecosystem. Several existing IoT device certifications (e.g. Cybersecurity Assurance Program, British Standards Institution, ioXt Alliance) prioritise cybersecurity through risk and vulnerability assessments. This paper proposes a complementary approach. Our tool focuses on identifying firmware functionality by analysing system calls through static analysis. This allows to publicly identify APIs to assess the actual behaviour of a firmware. The analysis culminates in the generation of JSON manifests, which encapsulate the relevant information gathered during the case study. In particular, this analysis verifies whether the actual behaviour is in line with the developer’s statements about the device’s functionality, contributing to the security and reliability of a device. To evaluate tool’s performance, we conducted a benchmarking analysis which has demonstrated efficient handling of binaries written in various languages, even those with large file sizes. Future will be based on refining the API search and syscall collection algorithms, other than incorporating vulnerability analysis to further strengthen the security of an IoT device.",0.57,0.55,0.65,0.57,0.54,0.65,7.67,1.43,1.43,1.43,5.17
https://openalex.org/W4400977204,ScaNeF-IoT: Scalable Network Fingerprinting for IoT Device,ARES (Validação DBLP),"Tadani Nasser Alyahya, Leonardo Aniello, Vladimiro Sassone",2024,"Recognising IoT devices through network fingerprinting contributes to enhancing the security of IoT networks and supporting forensic activities. Machine learning techniques have been extensively utilised in the literature to optimise IoT fingerprinting accuracy. Given the rapid proliferation of new IoT devices, a current challenge in this field is around how to make IoT fingerprinting scalable, which involves efficiently updating the used machine learning model to enable the recognition of new IoT devices. Some approaches have been proposed to achieve scalability, but they all suffer from limitations like large memory requirements to store training data and accuracy decrease for older devices.",4,4,"ScaNeF-IoT: Scalable Network Fingerprinting for IoT Device Recognising IoT devices through network fingerprinting contributes to enhancing the security of IoT networks and supporting forensic activities. Machine learning techniques have been extensively utilised in the literature to optimise IoT fingerprinting accuracy. Given the rapid proliferation of new IoT devices, a current challenge in this field is around how to make IoT fingerprinting scalable, which involves efficiently updating the used machine learning model to enable the recognition of new IoT devices. Some approaches have been proposed to achieve scalability, but they all suffer from limitations like large memory requirements to store training data and accuracy decrease for older devices.",0.52,0.51,0.65,0.48,0.53,0.65,7.67,1.43,1.43,1.43,5.17
https://openalex.org/W4385713422,Identification and Evaluation of Cyber-Physical Threats on Interdependent Critical Infrastructures,ARES (Validação DBLP),"Sandra König, Abdelkader Magdy Shaaban, Tamara Hadjina, Klemen Gregorc, Albert Kutej",2023,"Increasing interdependencies between critical infrastructures and digitization increase the vulnerability to cyber-attacks and cyber-physical attacks. Incidents have multiple direct and indirect consequences, including cascading effects, and a formal analysis is strongly recommended to understand these effects. This paper shows how threat identification and impact evaluation for interdependent critical infrastructures can be supported by two existing tools. The approach is illustrated with an example based on a running EU project.",4,4,"Identification and Evaluation of Cyber-Physical Threats on Interdependent Critical Infrastructures Increasing interdependencies between critical infrastructures and digitization increase the vulnerability to cyber-attacks and cyber-physical attacks. Incidents have multiple direct and indirect consequences, including cascading effects, and a formal analysis is strongly recommended to understand these effects. This paper shows how threat identification and impact evaluation for interdependent critical infrastructures can be supported by two existing tools. The approach is illustrated with an example based on a running EU project.",0.68,0.57,0.57,0.57,0.59,0.68,7.67,1.43,1.43,1.43,5.17
https://openalex.org/W4292158658,BISCUIT - Blockchain Security Incident Reporting based on Human Observations,ARES (Validação DBLP),"Benedikt Putz, Manfred Vielberth, Günther Pernul",2022,"Security incidents in blockchain-based systems are frequent nowadays, which calls for more structured efforts in incident reporting and response. To improve the current status quo of reporting incidents on blogs and social media, we propose a decentralized incident reporting and discussion system. Our approach guides users (security novices) towards a classification of their observations using a tiered taxonomy of blockchain incidents. Questions based on previous incidents interactively support the classification. Post submission a security incident response committee then discusses these observations on our decentralized platform to decide on an appropriate response. For evaluation, we implement our model as a decentralized application and demonstrate its practical suitability in a preliminary user study.",5,5,"BISCUIT - Blockchain Security Incident Reporting based on Human Observations Security incidents in blockchain-based systems are frequent nowadays, which calls for more structured efforts in incident reporting and response. To improve the current status quo of reporting incidents on blogs and social media, we propose a decentralized incident reporting and discussion system. Our approach guides users (security novices) towards a classification of their observations using a tiered taxonomy of blockchain incidents. Questions based on previous incidents interactively support the classification. Post submission a security incident response committee then discusses these observations on our decentralized platform to decide on an appropriate response. For evaluation, we implement our model as a decentralized application and demonstrate its practical suitability in a preliminary user study.",0.56,0.68,0.55,0.59,0.65,0.68,7.33,1.79,1.79,1.79,5.11
