id,title,venue,authors,year,abstract,citations,influential_citations,CPS,Blockchain,IoT,Fault Tolerance,Distributed Systems,sim_max,S_Quali,C_Norm,V_Norm,S_Quant,Score_Global,Perfil_Keywords
https://openalex.org/W4385688351,Exploiting Digital Twin technology for Cybersecurity Monitoring in Smart Grids,ARES (Validação DBLP),"Luigi Coppolino, Roberto Nardone, Alfredo Petruolo, Luigi Romano, Andrej Souvent",2023,"The adoption of Digital Twin technology has witnessed significant growth in various domains, enabling continuous monitoring and testing in diverse applications. In the context of safeguarding critical infrastructures, particularly smart grids, Digital Twin has emerged as a viable solution to meet the requirements outlined in the NIS2 directive issued by the European Commission. Additionally, the increasing trend in Europe towards establishing shared dataspaces, and fostering collaborative environments through data sharing, necessitates a heightened focus on cybersecurity risks.",28,28,0.64,0.58,0.56,0.57,0.56,0.64,7.67,10.0,10.0,10.0,8.6,
https://openalex.org/W4385713428,Digital Twin-Enhanced Incident Response for Cyber-Physical Systems,ARES (Validação DBLP),"David S. Allison, Paul Smith, Kieran McLaughlin",2023,"Cyber-physical systems underpin many of our society’s critical infrastructures. Ensuring their cyber security is important and complex. A major activity in this regard is cyber security incident response, whose primary goal is to detect and mitigate cyber-attacks in order to ensure the continuity and resilience of services. For cyber-physical systems this is particularly challenging because it requires insights both from the cyber and physical (process) domains and the engagement of stakeholders that are not strictly concerned with cyber security. A technology that is receiving a lot of attention are digital twins – virtual representations of real-world (cyber-physical) systems. They can be used to support tasks such as estimating the state of a system and exploring the consequences of interventional activities (e.g., upgrades).",21,21,0.72,0.53,0.57,0.59,0.55,0.72,7.67,7.5,7.5,7.5,7.6,
https://openalex.org/W4293637494,SOAR4IoT: Securing IoT Assets with Digital Twins,ARES (Validação DBLP),"Philip Empl, Daniel Schlette, Daniel Zupfer, Günther Pernul",2022,"As more and more security tools provide organizations with cybersecurity capabilities, security analysts are overwhelmed by security events. Resolving these events is challenging due to extensive manual processes, limited financial resources, and human errors. Security Orchestration, Automation, and Response (SOAR) is an established approach to manage security tools and assets. However, SOAR platforms typically integrate traditional IT systems only. Additional considerations are required to deal with the Internet of Things (IoT), its multiple devices and complex networks. Therefore, we adapt SOAR to IoT. We first aggregate existing research and information on SOAR and SOAR platforms. We envision the SOAR4IoT framework, making IoT assets manageable for SOAR via middleware. We implement a prototypical digital twin-based SOAR application integrating IoT assets and security tools to validate our framework. The experimental setup includes two playbooks coping with Mirai and Sybil attacks. Results show feasibility as our SOAR application enables securing IoT assets with digital twins.",20,20,0.6,0.61,0.65,0.56,0.62,0.65,7.67,7.14,7.14,7.14,7.46,
https://openalex.org/W4385688303,Artificial Intelligence for next generation cybersecurity: The AI4CYBER framework,ARES (Validação DBLP),"Eider Iturbe, Erkuden Rios, Angel Rego, Nerea Toledo",2023,"Artificial Intelligence (AI) is playing a crucial role both in the technological advances and emerging advanced threats in cybersecurity. Despite efforts by competent authorities in Europe to regulate the use of AI in a way that aligns with the ethics and individuals’ fundamental rights, there are still challenges to be tackled, not to mention the malicious use of AI by cybercriminals. In this paper we present a novel framework that is composed of innovative cybersecurity services that leverage AI to provide support in the management of the incident response and recovery lifecycle of the critical entities’ systems against advanced attacks. The paper describes the main components and architecture of the AI4CYBER framework and provides a clear understanding of the application of the autonomous intelligent cybersecurity services and their role in enforcing defensive actions throughout the entire lifecycle of the systems.",21,21,0.61,0.53,0.51,0.55,0.53,0.61,6.5,7.5,7.5,7.5,6.9,
https://openalex.org/W4385713496,On Deploying Quantum-Resistant Cybersecurity in Intelligent Infrastructures,ARES (Validação DBLP),"Lukáš Malina, Patrik Dobiáš, Jan Hajný, Kim‐Kwang Raymond Choo",2023,"As quantum-safe algorithms are increasingly implemented in security protocols used in current and emerging digital services, there is also a corresponding need to map the current state of security protocols and applications and their preparedness for the post-quantum era. In this paper, we review current security recommendations, existing security libraries, and the support of Post-Quantum Cryptography (PQC) in widely-used security protocols. We also present a practical assessment of recently selected PQC algorithms by the National Institute of Standards and Technologies (NIST) PQC standardization on typical platforms that can be deployed in intelligent infrastructures (e.g., smartphones and single-boards), and recently recommended hash-based signatures for software/firmware signing. Finally, we discuss how incoming post-quantum migration affects selected areas in intelligent infrastructures.",16,16,0.59,0.6,0.57,0.58,0.61,0.61,7.33,5.71,5.71,5.71,6.68,
